{
  "schemaVersion": "1.0",
  "id": "f3f2d351e9ff4e29a757c24662f4bb0d",
  "name": "httpbin",
  "variables": {
    "baseUrl": { "value": "https://httpbin.org", "type": "string", "source": "fixed", "enabled": true },
    "basicUser": { "value": "demo", "type": "string", "source": "fixed", "enabled": true },
    "basicPassword": { "value": "secret", "type": "string", "source": "fixed", "enabled": true },
    "bearerToken": { "value": "sample-token", "type": "string", "source": "fixed", "enabled": true },
    "apiKey": { "value": "sample-api-key", "type": "string", "source": "fixed", "enabled": true }
  }
}
