{
  "schemaVersion": "1.0",
  "id": "efc4135678444872bb65d04544a25113",
  "name": "dev",
  "variables": {
    "baseUrl": {
      "value": "https://httpbin.org",
      "type": "string",
      "source": "fixed",
      "enabled": true
    },
    "keyword": {
      "value": "readable-http",
      "type": "string",
      "source": "fixed",
      "enabled": true
    },
    "apiKey": {
      "value": "sample-api-key",
      "type": "string",
      "source": "fixed",
      "enabled": true
    }
  }
}